{
  "fixture_id": "skill-get-allowed-tools-happy-valid",
  "keyword_name": "Skill.Get Allowed Tools",
  "input_file_path": "tests/fixtures/skills/example-valid.md",
  "path_type": "happy",
  "expected_result_shape": {
    "type": "list",
    "min_length": 1,
    "contains_values": ["read_file"]
  }
}
